sku,title,description,price,stock,image_link,brand,ean,delivery_time
BODKBXB0DB5MDKX2,"Stofzuiger, 45000Pa/550W/60 Min Draadloze Stofzuiger met Smart Display, Stofzuiger met Wandmontage Opladen & Anti-Klit Borstel voor Tapijt, Harde Vloeren en Dierenharen (Upgrade)","<p>【45000Pa Zuigkracht voor efficiënte reiniging】 De snoerloze stofzuiger is uitgerust met een 550W-motor en biedt een krachtige zuigkracht van 45000Pa. Zeg vaarwel tegen fijne deeltjes, dierenharen en vuil op tapijten, harde vloeren en tegels. Ervaar een reinigingsniveau zoals nooit tevoren.</p>
<p><br />【60 minuten lange werktijd】 De stofzuiger is voorzien van een grote, afneembare accu met 7x2500mAh, waardoor de gebruiksduur met 35% wordt verlengd. Een volledig huis schoonmaken op één batterijlading is geen droom meer. Daarnaast leveren wij een wandgemonteerd oplaadstation dat de accu binnen slechts 4–5 uur volledig oplaadt.</p>
<p><br />【V-vormige anti-klit borstel】 De draadloze stofzuiger is uitgerust met een nieuwe V-vormige rolborstel en een 180° flexibele borstelkop die verstrikking van haren vermindert en gemakkelijk onder tafels, rond meubels en onder bedden reinigt. Heldere LED-verlichting helpt om stof zichtbaar te maken, zodat u niets over het hoofd ziet. Ideaal voor het grondig reinigen van kieren en het verwijderen van dierenharen en vuil in tapijten.</p>
<p><br />【5-laags filtersysteem met geurverspreiding】 De stofzuiger beschikt over een ingebouwd 5-traps HEPA-filtersysteem dat stofdeeltjes tot 0,1 micron opvangt met een filterefficiëntie van 99,99%. Tegelijkertijd zorgt een geïntegreerde aromatherapie-capsule voor een aangename geur tijdens het reinigen, wat de leefkwaliteit verhoogt. De stofopvangbak is vergroot tot 1,6L, waardoor u minder vaak hoeft te legen. Eénhandsbediening maakt het gebruik comfortabel en plezierig.</p>
<p><br />【HD-kleur OLED-display】 De krachtige snoerloze stofzuiger maakt het mogelijk om via aanraking de zuigmodus te wijzigen. Het OLED-display toont de resterende batterijduur en de bedrijfsstatus en geeft waarschuwingen bij storingen. Zo kunt u uw schoonmaakplanning efficiënt beheren en de levensduur van de batterij verlengen. De grote, haarscherpe symbolen zijn ideaal voor mensen met een slecht gezichtsvermogen, ouderen of mensen van middelbare leeftijd.</p>
<p><br />【7*24 Klantenservice】 Wij houden ons aan het principe dat de klant op de eerste plaats komt en streven ernaar u de beste producten en service te bieden. Wij garanderen dat elk probleem met uw stofzuiger binnen 24 uur wordt opgelost. Als u tijdens het gebruik problemen ondervindt, geef ons dan de kans om u te helpen. Alvast bedankt!</p>",189,50,https://http2.mlstatic.com/D_NQ_NP_909671-CBT84376489219_052025-F.jpg,Sanorum,9331855546230,7
BODKBXB0CW1QDRVV,"Nat- en Droogzuiger, 180° Plat Ontwerp Vloerreiniger met 13 cm Liggende Hoogte, 70°C 5min FlashDry Zelfreiniging, 3-Zijdige Randenreiniging, 40min Looptijd voor Reiniging onder Lage Meubels","<p>Buiging tot 180° voor het reinigen van verborgen plekken: De hoofdunit kan eenvoudig tot 180° worden gebogen, waardoor u gemakkelijk stof onder meubels of op moeilijk bereikbare plekken kunt verwijderen. Met een hoogte van slechts 13 cm in ingeklapte toestand kan de Stretch S6 zelfs onder meubels reinigen.<br />Reinigingsprestaties blijven behouden, zelfs wanneer volledig gebogen.</p>
<p><br />Zelfreinigend Flashdry-systeem: Reiniging met schoon water op 70 °C verwijdert effectief vlekken en reinigt grondig van de zuigbuis tot aan de borstelrol. Het drogen op 70 °C zuigt water volledig op. De rolborstel draait in beide richtingen, waardoor deze zachter en droger wordt en tegelijkertijd nare geurtjes vermindert.</p>
<p><br />Flexibele oplossingen voor betere reiniging: Miniwieltjes maken moeiteloos manoeuvreren in beide richtingen mogelijk. De schoonwatertank is boven de borstel geplaatst, wat het gewicht van het apparaat verlaagt en de bediening vergemakkelijkt. Bovendien maakt het 45° draaibare ontwerp beweging naar beide kanten mogelijk, zelfs als het apparaat gekanteld is.</p>
<p><br />Batterijduur tot 40 minuten: De tanks voor schoon en vuil water en de batterij worden continu aangepast door Tineco iLoop. Dankzij de geüpdatete batterij blijft de werktijd van de Stretch S6 zelfs na meerdere keren opladen 40 minuten, wat de autonomie effectief verlengt.</p>
<p><br />Eenvoudig onderhoud: Wij raden aan om het HEPA-filter regelmatig te reinigen en het vuilwatertankje na elk gebruik leeg te maken, om constante zuigkracht en reinigingsprestaties te behouden. Let op! Plaats het HEPA-filter vóór gebruik om watervlekken te voorkomen en vuil effectief op te zuigen.</p>",499,50,https://http2.mlstatic.com/D_NQ_NP_796629-CBT84376489625_052025-F.jpg,Sanorum,9331855546261,7
BODKBXB0D12H7B22,"45000Pa/550W/70Min Draadloze Stofzuiger, 1.6L Accu Stofzuiger Super Stil, Zelfopladende Steelstofzuiger met LED Display/Anti-Klit Borstel, Stofzuiger voor Harde Vloeren, Tapijten en Dierenharen","<p>【45000PA Superzuigkracht】 De Stars 5 draadloze stofzuiger maakt gebruik van speciale geluidsreductietechnologie (geluid <62 dB), die uw gezin en huisdieren beschermt tegen harde geluiden – zelfs wanneer de krachtige 550W-motor op hoge snelheid werkt. Met een zuigkracht tot 45000Pa verwijdert hij moeiteloos grof vuil en hardnekkige vlekken op vloeren, dierenharen en pluisjes op tapijten, evenals stof en vuil in hoeken, donkere plekken, langs muren en op moeilijk bereikbare hoge plaatsen.</p>
<p><br />【70 minuten lange batterijduur】 Deze draadloze stofzuiger beschikt over een krachtige 8-cellige accu van 2800 mAh. Na volledige oplading kan hij tot 70 minuten werken bij minimale zuigkracht en tot 30 minuten bij maximale zuigkracht. Plaats de stofzuiger eenvoudig terug op de wandhouder om automatisch op te laden. LET OP: bevestig de originele oplader eerst aan de wandhouder.</p>
<p><br />【V-vormige anti-klit borstel】 De stofzuiger voor dierenharen is uitgerust met een nieuwe V-vormige rolborstel en een flexibel 270° borstelhoofd, dat klitten van haren voorkomt en gemakkelijk rondom tafelpoten, muren, onder bedden en andere moeilijk bereikbare plekken reinigt. Heldere LED-verlichting helpt stof zichtbaar te maken zodat u geen vuil over het hoofd ziet. Ideaal voor het grondig verwijderen van haren en vuil in tapijten en spleten.</p>
<p><br />【99,99% Hoogwaardige filtering】 Het 8-laags hogedichtheidsfiltersysteem filtert tot 99,99% van het fijnstof en bacteriën, houdt het stof effectief in de stofcontainer en zuivert tegelijkertijd de uitgeblazen lucht. De stofcontainercapaciteit is vergroot tot 1,6L, waardoor minder vaak geleegd hoeft te worden. Eenvoudige bediening met één hand maakt het schoonmaken comfortabel en plezierig.</p>
<p><br />【HD-kleur OLED-display】 De krachtige draadloze stofzuiger maakt het mogelijk om via het touchscreen de zuigmodus te wijzigen. Het OLED-display toont de resterende batterijduur en bedrijfsstatus en geeft een waarschuwing bij storingen. Zo kunt u efficiënt plannen en de levensduur van de batterij verlengen. Grote en duidelijke symbolen zijn zeer geschikt voor mensen met slecht zicht, ouderen en mensen van middelbare leeftijd.</p>
<p><br />【7*24 Klantenservice】 Wij blijven trouw aan het principe dat de klant op de eerste plaats komt en streven ernaar u de beste producten en service te bieden. U profiteert van klantenservice + 2 jaar retour- en omruilgarantie. Mocht u problemen ondervinden bij het gebruik van de stofzuiger, geef ons dan alstublieft de kans om u te ondersteunen. Alvast bedankt!</p>",299,50,https://http2.mlstatic.com/D_NQ_NP_635875-CBT84376490485_052025-F.jpg,Sanorum,9331855546292,7
BODKBXB0D9JQG6Q5,"Stofzuiger, 45000Pa/550W/70 Min Draadloze Stofzuiger met Zelfstaande Functie, Anti-Klit Vloerborstel, Geurkaart, Hoogefficiënt Hepa-Filtersysteem voor Harde Vloeren, Tapijten en Dierenharen","<p>【45000Pa/550W krachtige zuigkracht】 De Kissof S17 draadloze stofzuiger is uitgerust met een superzuigkracht tot 45000 Pa en helpt u moeiteloos fijnstof, hardnekkige vlekken en grof vuil op tapijten en vloeren te verwijderen voor een grondige reiniging.</p>
<p><br />【70 minuten lange werktijd &amp; LED-display】 Deze krachtige snoerloze stofzuiger beschikt over een accu met hoge capaciteit. De oplaadtijd bedraagt slechts 4 uur. In de minimale modus bedraagt de gebruiksduur tot 70 minuten, in de maximale modus tot 20 minuten. Het grote kleur-LED-scherm toont 3 instelbare zuigstanden om aan uw dagelijkse schoonmaakbehoeften te voldoen.</p>
<p><br />【Handsfree zelfstaand ontwerp】 Deze draadloze stofzuiger kan zelfstandig rechtop staan, zodat u de schoonmaak eenvoudig kunt onderbreken. De staande structuur van de vloerborstel is meerdere keren verbeterd, waardoor de stofzuiger stabieler staat en effectief voorkomt dat hij omvalt. U kunt hem overal rechtop op de vloer plaatsen en genieten van meer bewegingsvrijheid tijdens het schoonmaken!</p>
<p><br />【2-in-1 anti-klit vloerborstel】 De V-vormige rolborstel, ontwikkeld door Kissof, combineert fijne borstelharen met rubberstroken. Dit verhoogt de reinigingsdiepte op tapijten en voorkomt effectief dat haren verstrikt raken.</p>
<p><br />【99,99% efficiënte filtering &amp; geurtablet】 Deze duurzame stofzuiger beschikt over een geïntegreerd 8-laags filtersysteem dat 99,99% van alle deeltjes tot een grootte van 0,1 micron opvangt. Geurtabletten kunnen bij de luchtuitlaat worden geplaatst om uw huis met een aangename bloemengeur te vullen.</p>
<p><br />【Dubbele handgreep &amp; 6 heldere LED-lampen】 Met het unieke dubbele handgreepontwerp van Kissof kunt u gemakkelijk vuil onder meubels zoals bedden en banken verwijderen. De 6 superheldere LED-koplampen op de vloerborstel verhogen de helderheid met 50% en zorgen voor een groter verlichtingsbereik, zodat u ook donkere hoeken goed kunt schoonmaken.</p>
<p><br />【7x24 klantenservice】 Wij houden altijd vast aan het principe ""klant eerst"". Wij staan klaar voor uw problemen en suggesties. Als u een probleem heeft met uw stofzuiger, neem dan contact met ons op. Wij reageren binnen 24 uur met een bevredigende oplossing.</p>",299,50,https://http2.mlstatic.com/D_NQ_NP_968589-CBT84376491315_052025-F.jpg,Sanorum,9331855546322,7
BODKBXB0CSFPG8GQ,"Stofzuiger, 45000Pa/550W/70Min Draadloze Stofzuiger met Smart Display, Stofzuiger met Automatische Modus & Anti-Klit Borstel voor Tapijt, Harde Vloeren en Dierenharen","<p>【Intelligente regeling van de reinigingskracht】 De MIBODE draadloze stofzuiger past dankzij automatische zuigkrachtregeling slim het vermogen aan op basis van de hoeveelheid stof en vuil, voor optimale reinigingsresultaten en een langere gebruiksduur.</p>
<p><br />【45000Pa zuigkracht voor efficiënte reiniging】 De draadloze stofzuiger is uitgerust met een 550W-motor en levert een krachtige zuigkracht tot 45000Pa. Zeg vaarwel tegen fijne stofdeeltjes, dierenharen en vuil op tapijten, harde vloeren en tegels. Ervaar een nieuw niveau van netheid.</p>
<p><br />【70 minuten lange gebruiksduur】 De stofzuiger is voorzien van een grote, afneembare accu met 8x2500mAh cellen, waardoor de gebruiksduur met 35% wordt verlengd. Uw hele huis schoonmaken met één acculading is nu realiteit. Inclusief een wandgemonteerd laadstation dat slechts 4–5 uur nodig heeft om volledig op te laden.</p>
<p><br />【Probleemloze haarverwijdering met anti-klit borstel】 De stofzuiger beschikt over een verbeterde V-vormige anti-klit rolborstel die haarverstrengeling effectief voorkomt. De borstelkop biedt indrukwekkende flexibiliteit met een bereik van 0° tot 180° zijwaarts en 0° tot 90° op- en neerwaarts, aangevuld met heldere LED-verlichting voor optimale reiniging in hoeken.</p>
<p><br />【Alles-in-één LED smart touchscreen】 Onze stofzuiger is uitgerust met een gebruiksvriendelijk HD LED-touchscreen. Alles is binnen handbereik: pas eenvoudig het zuigvermogen aan, bekijk de batterijstatus in realtime, volg uw schoonmaakvoortgang en geniet van het comfort en plezier van slimme reiniging.</p>
<p><br />【99,99% efficiënte filtratie + 1,6L grote stofcontainer】 De stofzuiger voor dierenharen beschikt over een dubbele cycloonstructuur voor krachtige filtratie. Het 5-laags filtersysteem verwijdert 99,99% van fijne stofdeeltjes, bacteriën en huisstofmijt tot 0,3 μm. De stofcontainer van 1,6 liter is ruim genoeg voor een volledige schoonmaak – ideaal voor allergielijders en huisdierbezitters.</p>
<p><br />【Toegewijde klantenservice na aankoop】 Mocht u vragen hebben, neem dan gerust contact met ons op. Wij garanderen dat elk stofzuigerprobleem binnen 24 uur wordt opgelost. Laat ons gewoon een bericht achter als u accessoires nodig hebt en niet weet waar u ze kunt kopen – wij staan altijd klaar om u te helpen.</p>",299,50,https://http2.mlstatic.com/D_NQ_NP_941278-CBT84376384619_052025-F.jpg,Sanorum,9331855546353,7
BODKBXB0DKFH66CN,"Draadloze Stofzuiger tot 60 Min. Looptijd & Stil | Accu Stofzuiger met LED Display, Zakloze Steelstofzuiger met Anti-Klit Vloerborstel voor Harde Vloeren en Tapijt + Geurschijf, HEPA-Filter","<p>Met een vermogen van 450W en een zuigkracht tot 45 kPa verwijdert deze stofzuiger moeiteloos stof, vuil en haren. De krachtige STS40-motor zorgt ervoor dat zelfs hardnekkig vuil efficiënt wordt verwijderd – ideaal voor tapijten, tegels, houten vloeren en laminaat. Dankzij het stille geluidsniveau van minder dan 62 dB kunt u uw huis rustig en comfortabel schoonmaken, zonder concessies te doen aan de prestaties.</p>
<p>Het geïntegreerde HEPA-filtersysteem verwijdert betrouwbaar 99% van alle deeltjes uit de lucht – waaronder stof, allergenen, virussen, bacteriën en chemische stoffen. Perfect voor mensen met allergieën en voor iedereen die waarde hecht aan een gezond binnenklimaat. Het royale stofreservoir van 1,6 liter maakt langdurig stofzuigen mogelijk zonder frequent legen. Zorg voor schone vloeren én frisse lucht in elke ruimte met één apparaat dat uw gezondheid ondersteunt.</p>
<p>Dankzij de lithium-ion batterij biedt de stofzuiger een gebruiksduur tot 60 minuten, zodat u grote oppervlakken en meerdere kamers in één keer kunt reinigen zonder tussentijds op te laden. Dit verhoogt de efficiëntie en flexibiliteit, omdat onderbrekingen door opladen tot het verleden behoren.</p>
<p>Met een totaalgewicht van slechts 2,8 kg is de stofzuiger licht en eenvoudig te hanteren. Of u nu trappen schoonmaakt, moeilijk bereikbare hoeken of oppervlakken – het compacte en ergonomische ontwerp zorgt voor comfortabel en moeiteloos schoonmaken, ideaal voor elk huishouden.</p>
<p>De stofzuiger is uitgerust met een geurtablet die tijdens het schoonmaken een frisse geur in de kamer verspreidt. Samen met de wandhouder voor ruimtebesparende opslag en LED-verlichting aan de voorkant voor beter zicht in donkere hoeken is hij niet alleen praktisch, maar ook een plezier om mee te werken.</p>",199,50,https://http2.mlstatic.com/D_NQ_NP_940432-CBT84376494083_052025-F.jpg,Sanorum,9331855546384,7
,,,,,,,,
